900,a male speech and wind and then birds chirping
901,while birds chirp and the wind blows an adult male speaks in the foreground and people talk in the background
902,a man speaking with light wind followed by brief silence then birds chirping 
904,a man talking as another man speaks in the background followed by birds chirping and leaves rustling while wind blows into a microphone
908,rustling and adult male speech and footsteps
910,a paper is being crumpled
911,plastic and paper crinkling as cardboard clacks against a hard surface
912,some crinkling of cellophane
913,crumpling occurs followed by a thud and then crinkling
914,paper is crinkling and crumpling and thumping occurs
917,bells ringing repeatedly
920,a domestic pet is making noises and a baby cries
930,a helicopter flying as wind blows into a microphone
932,a helicopter flying with wind heavily blowing into a microphone
934,helicopter propellers spinning and wind
940,several bursts and explosions with grunting and growling
941,bursts with groans and grunts
944,a series of bursting and popping sound effects
945,a bell is ringing
946,church bells ringing during audio static
954,tires squealing and an engine revving
956,paper tearing followed by an electric motor buzzing before more paper tears than crinkles as bells chime proceeded by a toilet flushing
957,an electronic motor buzzing and paper tearing followed by a bell chiming and a plastic click then a toilet flushing as paper crinkles in the background
959,an electronic device buzzing followed by paper tearing and then crumpling as a bell rings before a toilet flushes
965,motorcycle starting then driving away
966,motorcycle starting and taking off
967,plastic clacking followed by a motorbike and a motorcycle engine starting up then accelerating
968,starting a motorcycle
970,applause and speech followed by a loud high pitched bell and more applause and speech
971,a man and woman speak and people clap and a bell rings
973,an audience applauds and cheers as an adult male speaks a bell and buzzer ring and the adult male speaks again
974,a man and a woman talking followed by a bell ringing as a crowd of people applaud
980,a kid crying as a man and a woman talk followed by a car door opening then closing
981,a child cries followed by a man and woman speaking and then the child resumes sobbing
983,a kid crying as a man and woman talk while a vehicle door opens then closes
986,a man speaks with wind blowing and buzzing of insects
994,a person whistling followed by metal rattling in the background
1005,rain falling and thunder roaring in the distance
1007,rain and thunder
1010,an aircraft engine flying before becoming louder while several rapid gunshots fire
1011,vibrating followed by rapid gunshots with an airplane engine
1012,an engine chugging loudly together with gunfire
1013,machine gun fire coming from an airplane
1014,humming of an engine with rapid gunshots
1018,a person speaks and a goat bleats
1020,a motor vehicle is running and vibrating and a high-pitched squeal occurs
1021,vehicle engine running then a high whistle
1022,an engine humming and brakes squealing
1024,an engine running and screeching with rustling
1025,humming of a nearby jet engine
1028,an aircraft engine sharply running
1035,an infant crying
1036,an infant crying
1041,several breeds of birds chirping and honking
1042,wind blowing with ducks quacking and birds chirping
1044,birds are chirping ducks are quacking and other bird whistling noises
1048,a male speech and dishes clanking and doors banging
1050,wood lightly shuffling as insects buzz while birds chirp in the background
1052,insects buzzing as wood lightly shuffles and birds chirp in the distance
1054,insects buzz and distant birds chirp
1055,a man speaking as an insect buzzes followed by a woman laughing then another man talking
1056,a female speaking and an insect buzzing and then a male speaks
1057,a man talking as an insect buzzes followed by a woman laughing then a man talking
1058,an adult female speaks an insect buzzes the adult female laughs and then an adult male speaks
1059,a woman talks followed by a buzzing bee right before a man and woman take turns talking
1062,a man burping followed by belching while wheezing
1063,a man burping then inhaling followed by another burp while wheezing
1068,some light banging followed by water flowing and splashing
1069,someone moving around followed by sink water running
1070,a power tool drilling as music plays followed by someone blows air then plastic clanking and a man speaking
1071,drilling sound with light music in background then a man speaking
1072,a power tool drilling followed by someone blows air then a man talking as rock music plays in the background
1073,a power tool drilling followed by a person blowing air then a man speaking as light rock music plays in the background
1074,drilling with music playing and a man speaks
1075,a man talking followed by another man speaking then a group of people laughing and a man speaking a bit in the background
1076,men speak followed by laughing
1077,man speaking followed by group laughter
1078,a man is speaking followed by another male voice followed by laughter
1079,a man talking then another man talking followed by a group of people laughing then another man talking
1080,a crowd of people talking as ducks quack and a motorboat speeds by in the distance
1084,a motorboat drives in the distance as people talk and rap music plays in the background
1085,some child speaking in the distant and a toilet flushing
1090,two men speaking followed by plastic clacking then a power tool drilling
1093,two men communicating with each other followed by plastic clacking then a power tool drilling as wind softly blows into a microphone
1094,two men talking followed by plastic clacking then a power tool drilling
1096,a crowd of people applaud and cheer
1098,a crowd of people cheering and applauding
1099,a crowd of people shout and give applause
1106,nature sounds with birds chirping and singing
1107,nature sounds with birds chirping
1115,a muffled aircraft engine operating as a group of people talk in the background
1126,a group of puppies whimpering as cardboard rustles
1128,a group of puppies whimpering alongside scrapping against a cardboard surface 
1132,a vehicle engine revving as a crowd of people talk and whistle in the background
1135,hisses continuously with some static
1139,continuous hissing at varying levels
1142,water trickling followed by a toilet flushing then liquid draining through a pipe
1144,water gurgling followed by a toilet flushing then a footstep shuffling on a hard surface
1146,a low slow scream then a crash then birds chirping and men speaking
1148,groaning followed by a bang and breaking glass followed by men speaking with seagulls cawing in the distance
1149,a person screaming followed glass crashing then two men communicating with each other as seagulls squawk in the distance
1150,people talking while herding goats near a fast running stream
1151,rustling and knocking and then male speech with a goat vocalizing
1152,goats bleating and a man speaking
1160,a man speaking as plastic is clanking followed by a door hatch opening and plastic tumbling with a vehicle engine revving in the background
1163,a series of plastic clanking followed by a car door opening then a vehicle engine accelerating in the distance while a man is talking
1165,rain is splashing on a surface while rustling occurs and a car door shuts and traffic is discernible in the distance
1166,rain falls soft and steadily and a person closes a car door and walks away through leaves
1167,rain falling followed by fabric rustling and footsteps shuffling then a vehicle door opening and closing as plastic crinkles
1168,rain falling followed by footsteps walking on grass then a vehicle door opening then closing
1169,light rainfall together with rustling
1170,a vehicle engine gurgling followed by a horn tooting as wind blows into a microphone
1171,rattling and humming with a horn echoing and wind blowing
1172,rustling and shaking followed by a horn and gusts of wind
1173,a vehicle horn honking as a motor engine gurgles and wind blows into a microphone
1174,rattling of an engine with wind blowing and a horn honking
1182,an adult male speaks a cat caterwauls and hisses angrily and an adult female speaks
1186,a man speaking continuously
1190,a duck quacks repeatedly and soft thumping occurs a bird chirps twice and an adult male speaks
1192,a duck quacking and a bird chirping followed by footsteps on a wooden surface then a man talking
1193,a duck quacks as footsteps thump on wood while a bird chirps followed by a man talking
1200,graveling shuffling followed by a young kid talking as pigeons are cooing and a motor hums in the background
1202,humming with coos of pigeons and brief distant speaking
1203,mechanical humming with pigeons cooing and a person speaking briefly
1204,pigeons are cooing along with a machine rumbling noise and a man speaks
1206,a mid-size motor vehicle engine is idling and an adult male speaks
1216,female speaking and a sheep bleating
1217,an adult female and adult male speak in the foreground slight clattering is occurring and an animal bleats in the background
1218,a woman and young man are speaking over bleating sheep
1219,sheep bleat and a woman speaks
1220,plastic cranking followed by metal rattling then a series of metal falling in the background as a man is talking
1221,a man speaking as metal clanks and gears crank followed by pots and pans falling onto a hard surface
1226,wind blowing heavily into a microphone as seagulls squawk and ocean waves crash in the background
1228,seagulls squawking as ocean waves crash while wind blows heavily into a microphone
1232,water flowing and trickling
1234,water trickles down continuously
1236,a woman and a man talking through a telephone speaker
1237,a woman and man talk on the phone
1239,a woman and a man speaking through a telephone speaker
1242,an audience clapping
1243,a crowd applauding and cheering
1244,loud continuous applause
1255,a man talking as ocean waves trickle and splash while wind blows into a microphone
1256,a man talking as water splashes and wind heavily blowing into a microphone
1258,wind blowing and water splashing as a man speaks
1259,a man talking as water splashes and wind blows heavily into a microphone
1272,a door shutting followed by two men talking then a horn honking and slapping on a wooden surface
1273,a man speaks and then a horn blows 
1274,a door shutting followed by a couple of men talking then a horn honking and wood clanking
1275,a man speaks then whistles with a playing guitar
1276,a man speaks then whistles with a playing guitar
1277,a man talking then whistling as guitar music plays
1278,a man speaks followed by whistling and guitar music
1279,a man speaks followed by whistling and guitar music
1281,a vehicle engine revving numerous times then running idle
1300,a vehicle engine starting up then running idle
1301,a vehicle engine stalling then starting up and running idle
1302,a vehicle engine stuttering while starting up then running idle
1304,a vehicle engine stalling then starting up and running idle
1305,wind blowing followed by a scream with people speaking faintly in the distance
1307,wind blows hard followed by screaming
1309,a cat meowing followed by a person screaming as a man talks in the background and wind blows into a microphone
1316,a woman is speaking followed by a horse braying and speech from a crowd
1318,two young girls speaks with distant clop-clops followed by a loud gasp from a crowd
1321,a woman speaking together with a crowd of children murmuring
1324,children speak in the distance and a woman speaks nearby with some rustling and banging
1327,a man talking as metal thumps followed by plastic rustling then a power tool drilling while a metal pot clangs against a hard surface
1330,squeaking and bouncing followed by a man speaking
1331,several basketballs bouncing and shoes squeaking on a hardwood surface as a man yells in the distance
1332,a man yelling in the background as several basketballs bounce and shoes squeak on a hardwood surface
1333,a man yelling in the distance as several basketballs bounce and shoes squeak on hardwood floors
1334,multiple basketballs bouncing on a hard surface and shoes squeaking as a man shouts in the distance
1335,an infant crying as a group of kids and adults talk in the background while a woman talks in the foreground
1336,an infant crying as a group of women and children yell in the background as a woman talks in the foreground
1338,a kid crying as a crowd of people talk in the background and a woman is yelling
1339,a young child cries as people speak
1343,two men talking as a truck engine runs idle and wind blows into a microphone
1349,subway horn blows followed by the sound traveling down the rails
1355,sizzling and crackling are occurring
1360,a man talking before and after a young kid talks as plastic rattles followed by an electronic beep
1362,a man speaks followed by a beep and a child speaks
1363,an appliance motor is running and obvious vibration and knocking are occurring and an adult male and a child speak and the vibration continues followed by an electronic beep
1364,male speech and then a child speaks with repeated taps and a beep
1366,a crying and moaning in a low voice
1380,emergency sirens wailing as a vehicle accelerates in the distance
1385,babies are laughing followed by a fizzling sound
1388,babies laugh with a spray noise
1397,waves crash on a beach while the wind blows
1400,a subway train signal plays followed by a bell chiming followed by a horn honking as a crowd of people talk in the background
1405,a man talking as metal clacks followed by metal scrapping against a metal surface
1407,a man speaking with intermittent metal scraping 
1408,male speech and metal scraping
1410,horses growl and clop hooves
1411,a horse neighs followed by horse trotting and snorting
1412,horses neighing and snorting while trotting on grass
1413,horses neighing then snorting and trotting on a dirt surface
1414,horses neighing and stomping on the ground
1416,a man talking followed by a woman talking while an electronic beep plays with a person claps before someone belches then a man and woman laugh
1418,a man talking followed by a person clapping then electronic chimes alongside a woman talking before another person claps proceeded by a person belching and two people laughing
1420,audio static followed by a man laughing before an electronic device motor slides then an infant cries
1421,scary laughter by an adult male occurs followed by a click and a buzz and a baby begins crying
1423,a maniacal laugh followed by a crying baby
1424,wicked laughter followed by a baby crying
1429,an engine roars as someone is speaking over a machine
1432,a loud explosion as gusts of wind blow
1435,a telephone dialing tone followed by a plastic switch flipping on and off
1436,a telephone dialing tone followed by a plastic switch flipping
1437,a phone dial tone playing followed by a plastic switch flipping
1438,a telephone dialing tone beeping as a plastic switch flip on and off
1441,loading and firing of a gun with the sound of running o f footsteps at the end and a man speaking
1443,a gun cocking then firing as metal clinks on the ground alongside footsteps shuffling then a man talking with a synthesized slide whistle
1444,a gun cocking followed by a gunshot and a man talking
1447,an engine being turned over
1449,an engine being turned over
1450,frogs croaking and a humming with insects vocalizing
1461,an fire engine sounds the siren as an engine idles and a man speaks
1465,a telephone ringing
1468,a telephone rings several times
1471,man speaking continuously with hissing in the background
1472,a man is speaking with hissing background noises
1476,a train engine operating
1477,a train engine running
1480,a goat yelling while a group of people laugh and talk alongside bells jingling and a motorbike driving by in the distance
1482,a crowd of people talking and laughing with a motorbike engine running followed by a goat screaming then a person clicking
1484,a goat yelling as a crowd of people talk and vehicles drive by in the background followed by people laughing and someone clicking
1485,a footstep shuffling on a hard surface followed by plastic clacking then a toilet flushing
1486,tapping noises followed by a toilet flushing
1487,clinking followed by a toilet flushing
1488,some rustling followed by a toilet flush
1491,air hissing followed by a popping explosion then warning signals and a man laughing and talking
1492,released air hissing followed by a popping explosion then a metal ding persists as a person is laughing and a man is talking 
1493,steam hissing followed by a loud burst proceeded by warning sirens then a man laughing followed by another man talking
1496,a short beep sounds and people talk far away
1498,a shrill beep followed by four clicks while low voices converse in the background
1510,loud burping and screaming
1511,loud burping repeating
1512,a loud distorted belch followed by a series of burping
1513,several distorted belches followed by non-distorted burps
1517,'a group of young adults laughing followed by a man shouting as a stream of water splashes and flows while wind blows
1524,a hissing sound followed by laughter
1527,applause from a crowd with distant clicking and a man speaking over a loudspeaker
1528,a crowd of people talking then applauding as a man speaks over an intercom
1529,a man speaking over an intercom followed by a crowd of people talking then applauding
1531,a person is typing in a computer keyboard
1536,an infant laughing moderately
1538,an infant laughing
1539,a baby laughs repetitively
1542,water hissing followed by a man breathing loudly then a toilet flushing
1543,water hissing followed by a man breathing aloud then a toilet flushing
1544,a toilet flushing followed by a person breathing then metal clacking and a toilet flushing
1547,a crowd speak in the distance followed by sneezing
1548,a crowd of people talking as a person repeatedly coughs
1549,mid frequency of multiple people in the distance talking and yelling followed by coughing
1553,a water faucet flowing then stopping followed by water draining down a pipe
1570,a main is speaking over a group of bees are buzzing
1571,an adult male speaks while a many insects buzz
1587,a construction vehicle engine running and water splashing as wood crackles and snaps followed by electronic beeping and a man talking
1597,ocean waves crashing as water trickles as gusts of wind blow and seagulls squawk in the distance
1598,water flows and wind flows with seagulls in the distance
1599,ocean waves crashing and water splashing as gusts of wind blow and seagulls squawking in the distance
1606,a man talking followed by plastic crinkling and crumpling
1607,a man talking followed by plastic crinkling and crumpling
1608,a man speaks with some light crinkling of plastic
1613,water splashing as rain falls and trickles on a wet surface followed by thunder while wind blows into a microphone
1615,a toilet flushing followed by an infant shouting in the distance then another toilet flushing
1620,artillery cannons firing several times
1623,artillery cannons firing several times with an echo
1625,a horse clip-clops and a horse neighs from a distance
1632,distant murmuring and distant engine revving
1633,people are communicating followed by a dog barking and a vehicle moving
1636,a young boy talking as a duck is quacking while water trickles and frogs croak in the background
1637,a woman speaks with distant quacks of a duck
1638,a pretend duck quacks in cartoon fashion while an adult female speaks
1639,a female voice and a duck quacking
1641,music playing with some whooshes and gunshots with faint brief speaking
1643,loud metal/rock music plays with gunshots heard in the background
1644,music and gunfire with male speech
1645,drilling with intermittent stopping and a man moaning briefly
1654,a man speaking as a horse is trotting while a man talks then laughs in the background
1665,vibrating noise from an engine
1673,a motor vehicle is skidding its tires
1677,a small motor is running five hisses and a meow occur then five more hisses and a meow occur
1679,mechanical humming followed by meowing
1680,food sizzling while cooking
1682,food and oil sizzling
1683,food and oil sizzling
1685,a man talking followed by a woman shouting then yelling as wind blows into a microphone while birds chirp in the background
1686,a man talking followed by a woman shouting as wind blows into a microphone and birds chirp in the background
1703,a man talking as a machine motor hums followed by electronic buzzing
1704,a man speaking while power tools are whirring and running in the background
1705,a river stream flowing followed by a kid talking
1707,a stream of water rushing and trickling followed by a young man whooshing
1708,sounds of a river with man briefly mumbling
1710,someone whistles followed by a bird tweeting with chirps in the background
1711,whistling and birds chirping back and forth
1712,whistling with birds chirping
1713,whistling followed by birds chirping
1715,instrumental music playing as a woman speaks followed by rain pouring then rain falling on a surface
1716,music playing followed by a woman talking and rain falling then rain falling on a surface
1717,music with rain falling and a woman speaking
1718,a female speech music and rainfall
1719,females voice narrating a scene as music is playing and rain drops are falling
1723,a train makes hissing sound followed by people speaking lowly in the background
1725,engines hum and vibrate and rev their engines
1728,cars humming and rumbling as they rev and idle
1729,a vehicle engine running idle then revving as a crowd of people talk in the background
1734,a bus is driving and people are speaking
1735,a baby is crying and a woman speaks
1736,an infant crying followed by a child speaking in the background then a young woman talking
1738,an infant crying with another infant crying in the background followed by a woman speaking
1739,an infant crying followed by a child speaking in the background then a young woman talking
1740,whistling and then a female singing
1741,a person whistling followed by a young woman singing
1742,whistling with some distant humming and a girl singing
1743,a woman whistles and sings
1744,whistling occurs followed by an adult female singing
1751,a child laughing followed by a man talking as snow shuffles in the background
1753,a child laughing followed by a man talking as snow shuffles in the background
1756,a man talks in the background while a vehicle engine revs as tires skid then accelerates
1759,humming and accelerating of a car engine with squealing tires and people speaking faintly
1760,a woman speaks followed by a girl speaking faintly
1763,a woman talking followed by a young girl talking
1765,typing is occurring on a typewriter with fast and sharp taps and intermittent zipping of the carriage
1767,rapid typing and then sliding
1770,a door closes followed by a toilet flushing
1772,metal clacking followed by a door closing as water trickles then a toilet flushing
1774,metal rattling followed by a door slamming shut then plastic clacking proceeded by a toilet flushing
1782,a motorcycle engine is running and a man is talking
1783,motorcycle engine idles while a man speaks
1805,a man speaking as a vehicle horn honks in the background and another man talks in the distance
1807,a man speaking as a vehicle horn honks and a man speaks in the distance
1808,male speech with horns honking in the background
1811,a baby continuously crying
1813,a baby is crying
1816,beep then radio voice followed by gunshots and explosion
1817,helicopter running speech on a radio and then gunfire
1819,a man speaks as helicopter blades spin followed by loud explosions
1820,water pouring out of a faucet at a high rate followed by a container filling with liquid before splashing out proceeded by scrubbing on a plastic surface
1822,a faucet pouring water as water fills a container followed by scrubbing on a plastic surface and water splashing
1823,water running out of a faucet some hitting a sink bottom and some water filling a cup
1824,a faucet pouring water as a plastic container fills with liquid and scrubbing against a plastic surface while water trickles
1825,loud wolf whistles occur twice in a quiet environment
1828,high pitched rhythmic whistling
1831,whistling with wings flapping birds chirping and pigeons cooing
1832,whistling with pigeons cooing wings flapping and birds chirping
1833,a person whistling followed by pigeons cooing and bird wings flapping as birds chirp in the background
1834,whistling with flapping wings and cooing pigeons with other birds chirping
1841,a woman talking followed by a bird whistling then a woman whistling
1842,an adult female speaks and claps a bird whistles in the foreground another bird chirps in the background and then a human whistles a tune
1843,a woman talking followed by a bird whistling then a person whistling
1844,a woman talking before clapping followed by a bird whistling then a woman whistling
1845,wind blowing heavily into a microphone as a speedboat drives by and water splashes in the distance followed by a man talking
1847,wind noise while a water vehicle is traveling across water and a man talks
1850,insects buzzing as tin containers clank and rattle while birds chirp in the background
1855,sheep bleating with a baby sheep baaing
