2824,water splashes with people speaking in the distance and a faint whistle
2826,synthesized rumbling followed by an explosion
2832,thunder claps and rain falls hard splashing on surfaces
2835,a duck quacking followed by plastic camera muffling
2836,a duck quacking followed by plastic camera muffling
2837,a duck quacking followed by camera muffling
2838,a duck quacking followed by plastic camera muffling
2840,firecrackers popping as a crowd of people cheer and whistle
2841,firecrackers popping as a crowd of people cheer and whistle
2842,several loud pops with people cheering
2843,a crowd of people talk then cheer and whistle as firecrackers pop in the background
2845,whispering followed by loud consistent sizzling
2846,a man talks followed by whispering and food sizzling
2852,a female speech and then a toilet flushing followed by a female speech 
2853,a young woman speaks loudly with a toilet flushing sound
2854,speech followed by a toilet flushing and more speech
2860,bells chiming as birds chirp in the background followed by plastic clanking and shuffling
2861,a bell chiming as birds chirp followed by plastic clanking and shuffling
2863,a bell chimes followed by camera muffling then plastic shuffling and a clock ticking as birds chirp in the background
2871,woman speaking with fly buzzing around
2872,a woman speaks with nearby buzzing of insects
2873,buzzing and female speech
2874,a woman speaks with nearby insects buzzing
2875,water lapping in waves as a man talking
2885,plastic camera muffling followed by a man yelling as a pig squeals
2886,a pig squealing as a camera muffles and a man speaks briefly
2888,squealing from a pig
2889,a pig squeals and men speak
2890,an idle helicopter engine running as birds chirp in the background
2896,man speaking and clinking dishes
2899,dishes clanking followed by metal clanking on glass several times as a man is talking
2900,water pouring from a faucet and draining into a pipe while a young girl talks followed by a brush scrubbing then a person spitting
2902,water splashes followed by a girl speaking then scraping followed by spitting
2903,a child speaks followed by scrubbing and spitting
2904,splashing water followed by a girl speaking then scraping and spitting
2905,large church bells ring as rain falls on a hard surface and wind blows lightly into a microphone
2907,church bells ringing as rain pours and wind blows into a microphone
2908,church bells tolling as wind blows into a microphone and rain falls on a surface
2910,race car revving its engine
2911,humming of a loud powerful engine starting and speeding into the distance
2926,a sheep is bleating and a crowd is murmuring
2928,sheep baaing as wind is blowing into a microphone while a crowd of people talk in the background
2929,several animals are bleating and the wind is blowing while a group of people talk in the background
2932,hissing and chugging with brief muffled speech
2937,a race car is accelerating and shifting gears
2941,a man talking followed by footsteps shuffling then a loud popping explosion proceeded by a man laughing as music plays in the background
2943,a man talking as music is playing in the background followed by a popping explosion then a man laughing
2948,a person snoring at a rhythmic pace
2955,a muffled car engine revving several times as tires skid followed by a vehicle engine accelerating
2961,scrapping and filing of wood followed by a man talking as a dog barks in the background
2962,sanding and filing then a man speaks
2964,sanding and scraping followed by a man speaking
2966,male speech and a bug buzzing
2969,a man speaking as an insect is buzzing
2971,a man talking as a dog barks in the distance while wind blows into a microphone
2973,a man talking as a dog is barking in the distance and wind blows into a microphone
2974,a man talking with a dog barking in the distance as wind blows into a microphone
2975,u'a clock ticking followed by a cuckoo bird cooing then music playing 
2978,ticking is ongoing soft clicking occurs and a cuckoo calls once followed by musical chimes
2979,a clock ticking followed by plastic clacking then cuckoo bird cooing before bells chiming
2980,a man speaking followed by footsteps on gravel as birds chirp in the background
2990,a girl laughing as a person is snoring
2991,snoring is ongoing while an adult female laugh in the foreground and an adult male speaks briefly in the background
2992,a female laughs snoring occurs and an adult male speaks in the background
2993,snoring with some laughter
2994,an adult female laugh while snoring is occurring and an adult male speaks in the background
3002,leaves rustling as a leaf blower operates and wind blows into a microphone
3004,wind is blowing while a vacuum machine is in use
3006,a man is speaking as wind is blowing through the leaves
3008,a man speaking as wind blows through foliage and on a microphone
3009,a man speaks with wind blowing and leaves rustling
3023,a vehicle horn is repeatedly tooting followed by a passing engine rumble
3024,a large motor vehicle engine is running and a motor vehicle horn blows repeatedly and then stops
3030,a duck chirping as water lightly trickles and splashes
3031,a bird chirps and water splashes lightly
3032,water splashing and birds chirping
3033,a small birds chirps as water splashes
3034,chirping and water splashing lightly
3035,a dog is panting barking and yipping
3036,a dog barking and panting
3038,a dog is panting in a very fast tempo while barking few times
3039,dog yapping and panting
3040,metal squeaking and clanking followed by a man talking then a faucet pouring water
3044,metal squeaking then plastic clacking as a man is talking followed by a faucet pouring water
3045,a person snoring
3048,a person snoring
3051,water drips and splashes birds sing quietly in the distance
3054,water trickling and lightly splashing followed by an animal hooting in the distance
3055,rain falling as birds are chirping followed by thunder
3058,bird wings flapping then a bird chirping while rain falls followed by thunder
3066,sizzling and a female speaking
3067,women talk while food fries
3068,women talk over sizzling and clanking motor sound in the distance
3071,a woman talking as a dog snorts followed by an air ventilation system running
3072,an adult female speaks and an animal growls playfully
3081,sirens ring as a vehicle passes
3085,a man laughs followed by distant hums and birds chirping
3086,laughing and a motor running with birds chirping
3087,laughing and birds chirping with wind and an engine running
3089,a man laughing followed by another man yelling in the distance then wind blowing in a microphone as a motor hums and birds chirp in the background
3092,a group of people talking as an infant cries while a muffled bus engine runs
3094,a child cries continually while a motor vehicle engine runs quietly and several adult females and adult males speak
3095,water splashing with multiple voices in background
3099,water is falling splashing and gurgling a crowd of people talk in the background and an adult male speaks in the foreground
3105,rain noise on surface as men are speaking
3107,hard rain falls on a metal surface then three adult males speak while soft rhythmic whooshing occurs
3110,traffic sounds of vehicles with birds chirping and far away voices
3113,a loud engine is on as birds chirp and people are talking
3117,a river stream flowing rapidly
3118,water flows loudly
3119,water flowing down a river
3121,a horse making clip-clop noises
3122,clip clops of a horse running by
3123,a horse trotting
3124,clip clops from a horse
3130,a man speaking as a baby is crying over a radio
3131,a baby crying over a radio as a man is talking
3133,a baby cries while an adult male speaks
3134,a baby crying and a man speaking
3135,drilling noise loud and continue
3141,a man speaks with some clicking followed by wind blowing and a door opening
3146,insects buzzing followed by rattling and rustling
3147,birds are calling and many bees are buzzing then a child speaks briefly and rustling footfalls and rattling occur
3154,woman speaks and then sewing machine stitches
3155,a truck engine running followed by a truck horn honking
3157,engine idling continuously followed by honking
3158,a truck engine running followed by a truck horn honking
3159,humming and rustling from a large engine followed by two honks of a horn
3160,water softly trickling
3161,water makes gurgling sound
3163,a stream of water softly trickling
3164,a liquid gurgles as it drains
3168,a vehicle engine accelerating at a rapid rate before slowing down
3176,rain heavily pouring as wind blows into a microphone and streams of water trickle on a solid surface
3179,rain falling and wind blowing hard with rustling leaves
3181,a young girl talking as plastic crinkles and plastic thumping against a glass surface
3182,a girl speaking with plastic crinkling
3183,a girl talking as plastic crinkles followed by plastic thumping on a hard surface
3185,pigeons coo and flap their wings
3188,many pigeons cooing and flapping
3189,pigeons cooing and flapping their wings
3191,music plays along with whistling
3193,a person whistling along to a music
3194,a person whistling as music plays in the background
3200,a man talking as wood clanking as steam hisses in the background
3202,a man speaking with slapping on a wooden surface as compressed air hisses in the background
3207,a kid laughing and screaming with a man chuckling and woman whispering
3211,a person is typing on a keyboard with some ruffling
3225,frogs croaking with rustling in the background
3229,high pitched croaking of frogs with some rustling
3232,a truck horn honking as a large truck engine drives by while a crowd of people talk in the background
3233,a truck driving by as a truck horn honks while a crowd of people talk in the background
3235,bells chiming followed by a lawn mower engine running then a steam engine running and train whistle blowing while a crowd of people talk in the background
3251,an aircraft flying in the distance as wind blows into a microphone
3255,a group of men speaking as cannons fire while rain falls and water splashes followed by thunder roaring
3258,gunfire is ongoing and water is splashing adult males are shouting in the background and an adult male speaks in the foreground
3259,loud gunshots and explosions with men speaking water splashing wind blowing and thunder roaring
3263,a man is speaking with crinkling background noise
3264,man speaking while there is crinkling sound
3266,a sewing machine running and then female speech
3268,loud vibrations from a sewing machine followed by a woman speaking
3269,a sewing machine is in use and a woman talks
3270,a chainsaw cutting as wood is cracking
3271,sound of cutting with a chainsaw with a little pause and again followed by the same sound
3272,a chainsaw cutting as wood cracks and creaks
3273,a chainsaw running and crackling
3275,an adult male speaks in the foreground and dogs are barking and people are talking in the background
3276,a man is speaking and a dog is barking
3277,a man speaks over a loudspeaker with a crowd talking in the distance and dogs barking
3278,a man speaks over an intercom as crowd of people talking in the background followed by a dog barking
3279,a man speaking over an intercom as a crowd of people talk followed by a dog barking
3283,a woman speaks and food sizzles
3287,a woman speaking continuously
3290,a female voice briefly speaks followed by crinkling noises
3293,crinkling plastic and a person speaking
3300,a child talking followed by a man talking as a young boy mumbles while birds chirp in the background
3302,a young girl talking followed by a man talking then a young boy softly talking as birds are chirping in the background
3303,a child speaks followed by a man and child communicating as birds are tweeting
3304,a young girl speaking followed by a man speaking then a young boy speaking as birds chirp in the background
3309,a man speaking with some light knocking and high pitched scraping
3310,birds chirp and a duck quacks followed by a dog barking
3312,birds chirping and then a dog barking and a duck quaking
3313,a duck quacking followed by a dog barking as birds chirp then plastic popping and a film reel rolling
3321,dog panting followed by footsteps
3323,a dog panting and some rustling of footsteps
3325,an infant and a woman laughing followed by someone spits then a woman talking
3327,a baby laughs and a woman speaks
3329,a baby laughs and women laugh and speak
3332,a few electronic-sounding animal noises followed by barking from a small dog
3336,snoring is ongoing while an adult female laughs and an adult male speaks
3337,a man and a kid laughing followed by another man speaking as a person snores
3338,a person snores as a man talks and a person laughs
3340,an idle vehicle engine running
3341,an idle vehicle engine running
3345,a cat meowing once with a thud
3347,a cat meowing followed by metal clacking as a water sprinkler sprays in the background
3348,a cat meows and thumps occur twice while talking is present in the far background
3349,a cat meows as he enters the room and something is dropped with a big thump
3357,a boat engine starts up and idles
3360,a man talking as an infant is crying followed by a man humming
3362,a man talking as an infant is crying followed by a man humming
3364,a man talking as an infant is crying followed by a man humming
3366,a bell chiming as a man is speaking in the background followed by a muffled bell chiming
3367,a bell chiming as a clock ticks and a man talks through a television speaker in the background followed by a muffled bell chiming
3368,a bell chiming as a clock ticks while a man talks through a television speaker in the background followed by muffled a muffled bell chiming
3373,digital beeping with some clicks
3374,a beep and clicking noise repeat 
3380,police sirens sounding as wind is blowing heavily into a microphone
3381,wind and then a short ambulance siren repeats several times
3382,wind blowing and a siren rings
3383,police sirens wailing as wind blows heavily into a microphone
3384,an emergency siren going off as wind blows heavily into a microphone
3386,a man speaking on a microphone followed by another man speaking on a microphone as a crowd of people laugh and cheer
3390,rustling and then male speech and then creaking
3392,footsteps and scuffing occur after which a door grinds squeaks and clicks an adult male speaks and the door grinds squeaks and clicks shut with a thump
3393,footsteps walking on a hard surface followed by a door sliding open then a man talking before a door creaks and closes shut
3395,a duck quacking repeatedly and a horses hooves clopping
3396,ducks are quacking and water splashes softly
3398,ducks quaking and water lightly splashing
3402,birds are chirping and singing rustling occurs and an adult male speaks briefly in the foreground and an adult male speaks in the background
3406,race car racing by some people laughing
3407,a car engine accelerating and then laughter
3408,humming of a loud engine with people laughing
3410,motor cycle motor running on idle
3411,a motorcycle engine is idling
3419,a baby cries while electronic speech occurs in the background an adult female speaks a sneeze occurs and an adult female speaks once more
3426,continuous rainfall
3428,continuous rainfall
3429,continuous and steady rainfall
3442,sneezing followed by a ticking clock and a man speaking
3444,a rapid ticktock and then a man speaks and sneezes followed by another man hiccuping
3450,a power tool drilling as music plays in the background
3451,a sustained drilling noise as music plays in the background
3452,a power tool drilling as rock music plays
3454,a power tool drilling as rock music plays
3458,wind blows and waves crash with distant humming
3464,a vehicle engine revving and accelerating
3476,a goat baaing normally before and after a goat screaming
3478,a goat baaing normally before and after a goat screaming
3480,a vehicle horn honking as a series of electronic beeps chime followed by a plastic click
3482,a vehicle horn honking during a series of electronic beeps
3483,digital beeping with a horn honking twice
3484,a series of electronic dings while a vehicle horn honks twice followed by a plastic click while a dog barks in the distance
3485,a man talking followed by sawing then a metal click and plastic crinkling as water trickles and wind blows into a microphone
3487,a man speaking followed by sawing then plastic crinkling as water trickles
3489,puncturing sound followed by water trickling and a man speaking
3491,a loud airplane engine passes by and starts to diminish in the distance
3496,a man talking as a camera muffles followed by a loud explosion then a group of people laughing and talking
3497,a man is talking while plastic clacks followed by a popping explosion then a group of people talking and laughing
3506,a toilet flushing water as music plays in the background
3508,a flush occurs and suctioned water splashes and gurgles while music plays in the background
3511,trickling water sounds with breathing in the background
3515,an electronic device buzzing as music plays in the background followed by a woman talking faintly in the distance
3518,a small motor is running and whirring is occurring music is ongoing in the background and an adult female speaks briefly in the background
3524,a motorcycle driving then accelerating as a man talks over an intercom followed by another man cheering
3525,a man laughing
3526,a person laughing
3527,a man laughing
3528,a person laughs
3529,brief silence followed by a man laughing
3533,an engine struggling to start with some clicks
3534,an engine being started repeatedly
3540,a man speaking and another speaks over the phone
3541,a man speaking followed by another man speaking through a telephone speaker
3542,a man speaks nearby and another speaks over the phone
3543,a man speaking on the phone to another person
3544,male speech with another male speaking on the phone
3550,a woman coughs and sneezes several times
3551,a woman repeatedly sneezing and coughing
3556,a baby crying and cooing
3557,an infant crying as clothes rustle
3558,an infant crying as cloth shuffles
3559,an infant crying as fabric shuffles
3565,the clinking of glasses with some rustling
3566,glass clinks thumps occur and then silverware clatters
3568,dishes and silverware rattle and click from movement
3569,porcelain dishes clank followed by metal rattling
3571,a group of birds chirp and pigeons coo
3572,several birds chirping and pigeons cooing
3577,digital beeping followed by rapid vibrations and humming
3578,plastic tapping followed by an electronic beep then by a toy car motor revving and plastic scrapping against a wooden surface
3580,a man speaking on a microphone as a crowd of people laugh followed by glass clinking
3581,a man speaks as an audience laughs
3583,an adult male speaking through a microphone on a stage while an audience laughs at him
3584,an adult male is speaking and an audience is laughing
3604,a toy helicopter flying as a man speaks in the background while wind blows into a microphone
3610,a group of people talking in the background as compressed air sprays while a tin can rattles followed by a man talking
3617,a helicopter engine operating while wind blows heavily into a microphone
3618,strong wind is blowing an aircraft motor is operating and metallic whirring and faint rotor slapping are present
3619,a helicopter engine running idle as wind blows heavily into a microphone
3620,an engine running continuously together with clanking
3624,machine motors operating followed by glass boinking and a series of metal clacking and shuffling
3625,a train running on railroad tracks drives by as a train horn blows several times alongside a railroad crossing signal ringing
3630,wood cracking as metal clanks and slams against a wooden surface
3631,cracking and banging
3635,a toilet flushing followed by a person speaking in the distance as birds chirp in the background
3636,a toilet flushes as a bird chirps in the distance followed by a man speaking in the background
3639,a bird tweets far away and someone flushes the toilet
3641,a power tool drill operating followed by compressed air releasing and steam hissing
3645,a child sings happily over the clattering of a running machine
3646,a young girl singing as a sewing machine operates
3647,a girl sings while a sewing machine stitches and then speaks when it stops
3648,a child singing with consistent clanking followed by silence then tapping and speech
3649,a small girl sings with vibrations of a sewing machine which stops
3650,ducks quack and honk
3652,a duck quacking as wind lightly blows and water splats in the distance
3656,an ambulance siren with rain
3659,an emergency vehicle two-tone siren is blaring and fades and hissing is present
3660,rubbing occurs while the electric motor runs
3661,a machine works while something is rasping
3664,a motor humming as wood is being scrapped and sanded
3666,consistent muffled thunder
3668,thunder roaring in the distance as rain falls
3670,light wind with people screaming and engine running
3671,a man yelling in the distance followed by two girls shouting as a motorboat engine runs and water sprays while wind blows into a microphone
3672,strong gusts of wind are followed by cheers and shouts from several people plus the chatter of girl
3673,high wind with people yelling
3674,heavy wind followed by yelling and cheering
3677,a cat is meowing
3679,silence followed by white noise and meowing
3680,a woman speaks with some rustling and hissing
3681,a woman speaks with some rattling and some spraying
3682,a woman speaking followed by spraying
3683,a woman speaks with some clicks and then hissing
3684,a woman vocally demonstrating something followed by spraying
3685,frogs croaking together with a man speaking followed by rustling
3686,a man talking followed by plastic clunking and rattling as frogs croak and crickets chirp
3687,a man talking followed by plastic creaking and clacking as frogs croak and crickets chirp
3688,several frogs chirping near and far with men speaking and some banging
3690,a woman speaks with chirping frogs and distant music playing
3691,music plays as a woman speaks while a frog croaks followed by girl and boy speaking
3692,while music plays in the background a frog croaks young females speak and laugh and a young male speaks
3693,music is playing people are talking and a frog croaks
3695,birds chirping and water trickling
3696,several birds chirp with trickling water followed by booms of drums
3698,water is trickling as birds chirp and soft beats of a bass drum begin to occur
3699,water trickles as birds chirp then drums begin to play
3705,a vehicle accelerating and revving while tires are skidding
3706,a car engine accelerating and revving while tires skid
3707,a vehicle revving and accelerating as tires skid and squeak on a road
3710,man speaks followed by second man speaking then aircraft engine whines while starting
3711,a man talking followed by another man shouting then an aircraft engine starting up as vehicles drive by in the background
3712,man talking in the wind and someone yells in the background while an engine makes squealing and air puffing sounds
3714,men speak followed by vibrations and hissing with passing traffic in the distance
3715,a man exhaling then gasping for air followed by talking and gurgling
3716,a man gasping for air then talking followed by mumbling
3725,train horns honking as wind blows into a microphone while a group of people talk and an electronic beep repeatedly sounds during a vehicle engine running idle
3726,the wind is blowing a large motor vehicle engine idles an electronic signal beep a vehicle horn blows and faint speech is present in the background
3730,people speak followed by a loud air horn and people laughing
3731,a young man whispering followed by a horn honking then a group of people laughing while someone claps
3732,people whisper and then a horn sounds and people laugh
3733,people are whispering and a horn sounds followed by laughter
3734,a young man and a girl talking followed by a horn honking then a group of people laughing and a person clapping
3735,a man talking while another person talks in the distance as water trickles and birds chirp in the background
3739,a man speaking followed by a woman talking in the distance as a faucet pours water and birds chirp in the background
3746,water is running and hitting a surface and women speaks
3750,water splashing as a baby is laughing and birds chirp in the background
3751,splashing a baby laughs then a woman laughs
3752,water splashing and a baby laughing
3754,an infant and woman laughing as water splashes and birds chirp in the background
3760,a cat meows and hisses
3761,a cat meowing and hissing
3762,a cat meowing and hissing
3774,male speaking with sword clanging followed by a females giggle
3785,a man talking then whistling
3786,a man talks and then whistles
3787,a man talking then whistling
3788,a man talking then whistling
3789,a man speaking then whistling
3797,plastic cranking as rain heavily pours while a stream of water rapidly flows
3801,a clock ticking
3803,a clock ticking
3804,a clock ticking
3813,a motorcycle engine running idle then revving
3814,sputtering and humming of an engine
3815,a helicopter blades running
3816,a helicopter flying
3817,helicopter blades spinning then fading away
3824,a man is speaking as food is frying
3827,several people cheer and scream and speak as water flows hard
