1232,water flowing and trickling
1237,a woman and man talk on the phone
1255,a man talking as ocean waves trickle and splash while wind blows into a microphone
1256,a man talking as water splashes and wind heavily blowing into a microphone
1258,wind blowing and water splashing as a man speaks
1259,a man talking as water splashes and wind blows heavily into a microphone
1261,tapping noise followed by splashing and gurgling water
1270,two adult males speak a small horn blow and clattering occurs
1271,men talking over a background humming noise then an alarm blares
1272,a door shutting followed by two men talking then a horn honking and slapping on a wooden surface
1273,a man speaks and then a horn blows 
1274,a door shutting followed by a couple of men talking then a horn honking and wood clanking
1275,a man speaks then whistles with a playing guitar
1276,a man speaks then whistles with a playing guitar
1277,a man talking then whistling as guitar music plays
1278,a man speaks followed by whistling and guitar music
1279,a man speaks followed by whistling and guitar music
1295,vibrations of an idling engine with a man speaking
1300,a vehicle engine starting up then running idle
1301,a vehicle engine stalling then starting up and running idle
1302,a vehicle engine stuttering while starting up then running idle
1304,a vehicle engine stalling then starting up and running idle
1305,wind blowing followed by a scream with people speaking faintly in the distance
1315,a kid speaking as camera plastic clicking followed by a crowd of people gasping and talking followed by a person whistling
1318,two young girls speaks with distant clop-clops followed by a loud gasp from a crowd
1319,a young girl talking as a crowd of people talk then gasp
1320,a woman talking while a group of children shout and talk in the background
1321,a woman speaking together with a crowd of children murmuring
1327,a man talking as metal thumps followed by plastic rustling then a power tool drilling while a metal pot clangs against a hard surface
1331,several basketballs bouncing and shoes squeaking on a hardwood surface as a man yells in the distance
1332,a man yelling in the background as several basketballs bounce and shoes squeak on a hardwood surface
1333,a man yelling in the distance as several basketballs bounce and shoes squeak on hardwood floors
1334,multiple basketballs bouncing on a hard surface and shoes squeaking as a man shouts in the distance
1336,an infant crying as a group of women and children yell in the background as a woman talks in the foreground
1338,a kid crying as a crowd of people talk in the background and a woman is yelling
1339,a young child cries as people speak
1343,two men talking as a truck engine runs idle and wind blows into a microphone
1345,a train honks horn and passes by
1348,a train horn honking followed by a train running on railroad tracks
1351,a bell chiming as a clock is ticking
1352,a bell ticks with a thumping noise
1353,a bell chiming as a clock is ticking
1359,meat sizzling with insect sounds in background
1363,an appliance motor is running and obvious vibration and knocking are occurring and an adult male and a child speak and the vibration continues followed by an electronic beep
1375,instrumental music playing followed by heavy fabric being rustled then a man whistling
1385,babies are laughing followed by a fizzling sound
1388,babies laugh with a spray noise
1399,close ocean waves
1407,a man speaking with intermittent metal scraping 
1408,male speech and metal scraping
1410,horses growl and clop hooves
1411,a horse neighs followed by horse trotting and snorting
1412,horses neighing and snorting while trotting on grass
1413,horses neighing then snorting and trotting on a dirt surface
1414,horses neighing and stomping on the ground
1416,a man talking followed by a woman talking while an electronic beep plays with a person claps before someone belches then a man and woman laugh
1418,a man talking followed by a person clapping then electronic chimes alongside a woman talking before another person claps proceeded by a person belching and two people laughing
1420,audio static followed by a man laughing before an electronic device motor slides then an infant cries
1423,a maniacal laugh followed by a crying baby
1429,an engine roars as someone is speaking over a machine
1435,a telephone dialing tone followed by a plastic switch flipping on and off
1436,a telephone dialing tone followed by a plastic switch flipping
1437,a phone dial tone playing followed by a plastic switch flipping
1438,a telephone dialing tone beeping as a plastic switch flip on and off
1439,dialing and clicking
1441,loading and firing of a gun with the sound of running o f footsteps at the end and a man speaking
1442,clicks of weapons being loaded followed by a gunshot and a clink then a man speaks
1444,a gun cocking followed by a gunshot and a man talking
1465,a telephone ringing
1466,a telephone rings repeatedly with some buzzing in the background
1467,an old fashioned telephone ring occurs repeatedly and buzzing is present in the background
1468,a telephone rings several times
1471,man speaking continuously with hissing in the background
1472,a man is speaking with hissing background noises
1480,a goat yelling while a group of people laugh and talk alongside bells jingling and a motorbike driving by in the distance
1482,a crowd of people talking and laughing with a motorbike engine running followed by a goat screaming then a person clicking
1484,a goat yelling as a crowd of people talk and vehicles drive by in the background followed by people laughing and someone clicking
1485,a footstep shuffling on a hard surface followed by plastic clacking then a toilet flushing
1487,clinking followed by a toilet flushing
1488,some rustling followed by a toilet flush
1492,released air hissing followed by a popping explosion then a metal ding persists as a person is laughing and a man is talking 
1493,steam hissing followed by a loud burst proceeded by warning sirens then a man laughing followed by another man talking
1496,a short beep sounds and people talk far away
1498,a shrill beep followed by four clicks while low voices converse in the background
1517,'a group of young adults laughing followed by a man shouting as a stream of water splashes and flows while wind blows
1524,a hissing sound followed by laughter
1527,applause from a crowd with distant clicking and a man speaking over a loudspeaker
1528,a crowd of people talking then applauding as a man speaks over an intercom
1530,keys typing repeatedly
1533,typing on computer keyboards
1535,a baby laughing loudly
1536,an infant laughing moderately
1537,an baby laughing
1538,an infant laughing
1539,a baby laughs repetitively
1543,water hissing followed by a man breathing aloud then a toilet flushing
1548,a crowd of people talking as a person repeatedly coughs
1549,mid frequency of multiple people in the distance talking and yelling followed by coughing
1570,a main is speaking over a group of bees are buzzing
1571,an adult male speaks while a many insects buzz
1597,ocean waves crashing as water trickles as gusts of wind blow and seagulls squawk in the distance
1598,water flows and wind flows with seagulls in the distance
1599,ocean waves crashing and water splashing as gusts of wind blow and seagulls squawking in the distance
1605,a man talking followed by plastic crumpling and crinkling
1606,a man talking followed by plastic crinkling and crumpling
1607,a man talking followed by plastic crinkling and crumpling
1613,water splashing as rain falls and trickles on a wet surface followed by thunder while wind blows into a microphone
1615,a toilet flushing followed by an infant shouting in the distance then another toilet flushing
1620,artillery cannons firing several times
1622,loud explosions and burst that echo
1623,artillery cannons firing several times with an echo
1627,hissing and buzzing of insects with a horse neigh and clip clops
1636,a young boy talking as a duck is quacking while water trickles and frogs croak in the background
1637,a woman speaks with distant quacks of a duck
1638,a pretend duck quacks in cartoon fashion while an adult female speaks
1639,a female voice and a duck quacking
1640,music plays followed by some banging and whooshes then gunshots and a grunt from a man
1641,music playing with some whooshes and gunshots with faint brief speaking
1642,music plays continuously along with swooshing followed by a man speaking quickly
1643,loud metal/rock music plays with gunshots heard in the background
1654,a man speaking as a horse is trotting while a man talks then laughs in the background
1672,a vehicle engine revving as tires skid and squeal
1673,a motor vehicle is skidding its tires
1676,a domestic animal meows
1677,a small motor is running five hisses and a meow occur then five more hisses and a meow occur
1680,food sizzling while cooking
1685,a man talking followed by a woman shouting then yelling as wind blows into a microphone while birds chirp in the background
1689,distant clip clops of horses with a man speaking and a woman screaming
1699,water splashing and wind blowing over a microphone
1703,a man talking as a machine motor hums followed by electronic buzzing
1704,a man speaking while power tools are whirring and running in the background
1707,a stream of water rushing and trickling followed by a young man whooshing
1710,someone whistles followed by a bird tweeting with chirps in the background
1711,whistling and birds chirping back and forth
1712,whistling with birds chirping
1713,whistling followed by birds chirping
1715,instrumental music playing as a woman speaks followed by rain pouring then rain falling on a surface
1716,music playing followed by a woman talking and rain falling then rain falling on a surface
1717,music with rain falling and a woman speaking
1718,a female speech music and rainfall
1723,a train makes hissing sound followed by people speaking lowly in the background
1730,a bus accelerating followed by a man speaking
1733,a bus engine accelerating followed by a man talking then a woman speaking in the background
1735,a baby is crying and a woman speaks
1738,an infant crying with another infant crying in the background followed by a woman speaking
1740,whistling and then a female singing
1741,a person whistling followed by a young woman singing
1742,whistling with some distant humming and a girl singing
1743,a woman whistles and sings
1744,whistling occurs followed by an adult female singing
1751,a child laughing followed by a man talking as snow shuffles in the background
1753,a child laughing followed by a man talking as snow shuffles in the background
1756,a man talks in the background while a vehicle engine revs as tires skid then accelerates
1758,a vehicle engine running idle as a man is talking then accelerating with tires skidding and squeaking
1759,humming and accelerating of a car engine with squealing tires and people speaking faintly
1760,a woman speaks followed by a girl speaking faintly
1765,typing is occurring on a typewriter with fast and sharp taps and intermittent zipping of the carriage
1766,typing on a typewriter
1767,rapid typing and then sliding
1769,typing on a typewriter
1770,a door closes followed by a toilet flushing
1772,metal clacking followed by a door closing as water trickles then a toilet flushing
1774,metal rattling followed by a door slamming shut then plastic clacking proceeded by a toilet flushing
1782,a motorcycle engine is running and a man is talking
1783,motorcycle engine idles while a man speaks
1805,a man speaking as a vehicle horn honks in the background and another man talks in the distance
1808,male speech with horns honking in the background
1813,a baby is crying
1819,a man speaks as helicopter blades spin followed by loud explosions
1823,water running out of a faucet some hitting a sink bottom and some water filling a cup
1824,a faucet pouring water as a plastic container fills with liquid and scrubbing against a plastic surface while water trickles
1825,loud wolf whistles occur twice in a quiet environment
1831,whistling with wings flapping birds chirping and pigeons cooing
1832,whistling with pigeons cooing wings flapping and birds chirping
1834,whistling with flapping wings and cooing pigeons with other birds chirping
1835,a man talks as an engine idles loudly
1841,a woman talking followed by a bird whistling then a woman whistling
1842,an adult female speaks and claps a bird whistles in the foreground another bird chirps in the background and then a human whistles a tune
1843,a woman talking followed by a bird whistling then a person whistling
1844,a woman talking before clapping followed by a bird whistling then a woman whistling
1845,wind blowing heavily into a microphone as a speedboat drives by and water splashes in the distance followed by a man talking
1847,wind noise while a water vehicle is traveling across water and a man talks
1861,various conversation occur in a crowd a train bell dings followed by a train whistle cheering occurs at the end
1862,muffled crowd noise while a bell dings
1866,a man talking as rain falls and thunder roars in the background
1875,a cat meowing and young female speaking
1876,a young kid is talking as a cat is growling then meowing with a series of electronic buzzing
1877,a cat screaming then meowing as a young boy is talking during a series of electronic buzzing
1878,a cat meows and hisses and a child speaks
1879,a cat is meowing and a child is speaking
1895,a woman speaks followed by a sewing machine slow stitching
1898,humming followed by a woman speaking with slow ticks of a sewing machine
1899,humming followed by a woman speaking and slow clicks of a sewing machine
1904,low speech from a man followed by machine making a beeping noise
1905,a quick burst of vibrations from a sewing machine with clicking and rattling
1908,a sewing machines a sewing then suddenly stopping with some squeezing
1910,leaves rustling in the wind with dogs barking and birds chirping
1911,a person clapping followed by a dog barking then knocking on a glass surface as birds chirp during outdoor ambiance
1912,a person clapping followed by a dog barking then wood clanking as birds chirp and gusts of wind blow in the background
1913,a dog barks along with outdoor noises
1914,a dog barks quickly
1917,a young woman is talking 
1928,a small child speaks followed by crinkling and cracking
1937,a mid-size motor vehicle engine is idling and clacking somewhat followed by mid-size motor vehicles accelerating quickly with a brief tire squeal
1945,a crowd applauds with laughter while people communicate followed by a woman speaking
1946,a crowd is applauding an adult female speaks the crowd laughs claps and whistles and then another adult female begins to speak
1948,applause a female speech and whistling
1950,a gunshot is followed by a click and clack and then a second gunshot
1951,ducks squeaking in the distance followed by a shotgun blast
1952,birds chirp followed by some clicking then gunshots
1953,birds chirping as a gun cocks followed by a gunshot and a man chuckling while metal clanks then another gunshot alongside ducks quacking
1954,metal clicking before a gunshot firing followed by a person sighing and metal clanking while wood clacks proceeded by another gunshot firing as ducks quack in the distance
1956,several cats meowing followed by a man singing in the background
1958,several cats meowing followed by a man singing in the background
1977,humming of a large truck engine with blowing wind
1980,a fire truck sounds the siren and an engine is idling
1981,an emergency vehicle sounds siren followed by a vehicle engine idling
1982,an emergency siren wailing followed by a large truck engine running idle
1983,emergency sirens followed by an engine idling
1984,sirens of an ambulance and fire truck traveling and an engine idling
1988,rain falls tapping on metal a vehicle runs in the distance the tapping sound fades as the rain continues
1996,a woman shrieking and laughing followed by a man laughing in the background and a woman speaks a few words
1998,a woman laughs and then a man laughs with her followed by a boy speaking
2000,pigeons peck coo and flap their wings before a man speaks
2002,pigeons are cooing flapping and a man talks
2004,birds are flapping wings and making noises and a man talks
2007,a mid-size engine is idling and vibrating and is revved up one time
2019,a man speaking while beating eggs
2020,rapid typing and then a ding
2022,typing on a typewriter is ongoing with clicking and clacking a bell rings and a clack occurs with the carriage return
2024,typing on a typewriter followed by a bell chiming
2027,a man speaking followed by applause and laughter from an audience
2034,rattling and banging with faint humming
2038,a child talking followed by a group of people talking then a man talking
2039,a kid talking followed by a group of people talking then a man speaking proceeded by a young girl talking
2040,muffled static followed by a popping and water dripping as birds chirp and vehicles drive by in the background
2041,water is flowing and dripping then suddenly something is broken and birds are communicating in the background
2045,police car siren starts with two horn blasts then becomes a high pitched wail
2054,a toy helicopter flying then powering down before powering up
2055,a synthesized rumble followed by a robotic woman talking alongside electronic beeps followed by a man speaking then another man speaking through an intercom as music plays in the background
2056,a whooshing effect followed by a robotic woman speaking and electronic beeps then a man speaking and music playing along with a man speaking through an intercom
2058,a loud whoosh with computer female voice a beep then male speaking
2059,a loud whoosh followed by a woman speaking then digital beeps and men speaking
2060,a man speaking while crinkling paper followed by plastic creaking then a toilet flushing
2061,a man speaks with some clicking and rattling followed by a flushing toilet
2062,a man talking as paper crinkles followed by plastic creaking then a toilet flushing
2070,a man speaks during a monologue
2083,girl speaks then a loud burp followed by girls laughing
2084,a plastic clack followed by young girl talking then another a young girl burping proceeded by both girls laughing
2090,people are laughing followed by a kid speaking
2106,artillery cannons firing followed by a man talking as someone whistles while a group of men shout and gunshots fire in the background
2113,water is trickling and splashing into more water and thumping is occurring a young child coos and an adult female speaks
2114,water splashing items floating in the water something doping in to the water women voice
2120,bird cooing then the sounds of wings flapping
2125,rain falling with young female speaking
2129,a person laughing followed by a girl shouting as rain is falling on a plastic surface
2135,whistling and then laughing with a male speaking in the distance
2136,young children are whistling and laughing
2137,whistling followed by a child giggling and then moe whistling
2138,a person is whistling and baby is laughing followed by a man talking
2139,a person whistling followed by a young girl laughing as a man talks in the background then another person whistling
2140,a woman breathing heavily followed by two sneezes then nose sniffling
2141,a person breathing heavily then sneezing
2142,a person breathes heavily and sneezes
2143,a woman sneezing and sniffling
2144,a woman heavily breathing then sneezing and then sniffling
2148,a few gunshots followed by a man speaking
2151,a man talking as sheep baa while wind blows into a microphone
2152,wind blows and a man speaks followed by a goat bleating
2153,wind and a goat bleating while a man speaks
2166,a motorboat accelerating and water splashing
2176,wind blows and people speak before goats bleat near and far with distant birds chirping
2177,wind is blowing and birds are chirping a metal bell clangs quietly once and multiple animals bleat while two men speak in the background
2179,a goat bleats and background voices
2180,knocking noises followed by a machine sawing
2181,tapping followed by high pitched buzzing
2184,hard planks click together and an electric saw cuts material
2212,an adult male speaks and a crowd laughs and then cheers and applauds
2217,heavy footsteps walking on a hard surface followed by a man grunting then two explosions
2219,wind blowing followed by heavy footsteps on a solid surface then a man groaning proceeded by two explosions
2220,man talks while sheep bleats followed by another man laughing
2221,loud laughter followed by a brief baa rustling and male speech
2222,men laughing with goat bleating in background
2223,a man is laughing followed by a sheep bleating then man continues to talking
2226,metal clanging as a construction vehicle operates in the background followed by bird wings flapping and pigeons cooing
2227,pigeons cooing and bird wings flapping during light scrapping on a metal surface while a construction machine operates in the background
2229,rattling is followed by pigeon wing flapping and vocalization
2230,a young girl talking while an infant laughs
2232,a young girl talking as an infant is laughing
2234,a young girl talking as a baby is laughing
2240,squealing from a pig with dogs barking and a man speaking
2241,a dog barking followed by a man talking as footsteps walk on grass while a pig oinks
2242,a pig squeals and dogs bark followed by a man speaking
2243,a dog barking as footsteps walking on foliage and a man talking while a pig squeals
2244,oinking pig and barking dog followed by man speaking
2245,an adult male gives a speech
2246,a man speaking into a microphone
2247,a male speaking over a microphone
2248,a man is speaking on a microphone
2249,a man speaking into a microphone
2260,a sewing machine lightly operating as a man speaks before plastic clicking followed by a man speaking again
2261,vibrations from a sewing machine followed by clicks and a man speaking
2263,a sewing machine running then stopping as a man talks followed by a metal click then a soft electronic beep and another metal click
2264,vibrations from a sewing machine with a man speaking with several clicks and beeps
2276,animal sounds and a scream
2290,a sewing machine operating during several metal clacks
2292,a sewing machine operating during several metal clacks
2293,a sewing machine lightly operating after a couple of metal clacks
2294,metal clicking and clacking as a sewing machine slowly operates
2295,a sewing machine operating several times as a man is speaking
2300,drums play as swooshing occurs
2301,a series of whooshing effects as a drum plays music
2302,percussion music playing alongside a series of whooshes followed by a motor humming
2303,music playing and whooshing is happening
2311,a short single beep followed by a man talking
2315,emergency vehicle racing by with siren and a man yelling
2316,a crowd of people talking as emergency sirens sound and a truck accelerates followed by a man speaking over an intercom
2317,a truck engine driving by while emergency sirens wail as a crowd of people talk followed by a man speaking over an intercom
2318,a truck accelerating as emergency sirens wail during a crowd of people talking followed by a man speaking on an intercom
2321,continuous laughing with brief tapping and speech
2324,several people laughing continuously with brief clanking and speech
2330,a woman talking as a crowd of people talk in the background while a lawn mower engine runs followed by a horse neighing
2331,a crowd of people talking followed by a horse neighing as a lawnmower engine runs in the background
2332,'an engine with people speaking and a horse neighing
2333,a crowd of people talking followed by a horse neighing as a lawn mower runs in the background
2334,humming of an engine with people speaking and a horse neighing
2339,water trickling onto a metal surface and filling a container
2340,a woman talking as goats are baaing followed by footsteps on gravel then a man talking while an airplane flies in the distance
2345,a man is speaking while typing
2346,a man is speaking while typing on a keyboard
2347,an adult male is speaking and typing on a keyboard
2348,typing on a keyboard as a man is talking
2350,footsteps are followed by oinking and then a squeal
2352,a grunt from a person followed by footsteps and oinks from a pig with a single squeal
2354,a walking in the grass and a pig oink sound
2355,a vehicle engine running then powering down followed by a man talking in the background
2366,a vehicle horn honking a melody
2367,white noise followed by a musical horn honking
2368,a vehicle horn blares out a musical tune
2374,wind blows hard
2377,a man speaking as footsteps walk on grass while insects are buzzing
2381,door opening and sliding
2383,opening and closing a door
2386,several loud gunshots
2388,several gunshots in quick succession
2400,water splashing and trickling as wind blows into a microphone while a man speaks over a radio
2401,wind blowing and water splashes with a man speaking over a radio
2409,a dog barking while wind blows into a microphone followed by a man speaking in the distance proceeded by a bicycle pedaling alongside leaves rustling and a camera muffling
2413,a person snoring as plastic repeatedly taps the distance
2414,snoring and heavy breathing
2416,ducks quacking and chirping as a rooster crows and a crowd of people talks in the background
